{
  "schema_version": 1,
  "id": "sensevoice-small",
  "display_name": "SenseVoiceSmall",
  "capability": "transcription",
  "source": {
    "provider": "modelscope",
    "repository": "iic/SenseVoiceSmall",
    "revision": "43d0ed61231c41f8393fa347b838a1f6e2d264f6",
    "revision_policy": "pinned"
  },
  "files": [
    {"path": "am.mvn", "sha256": "29b3c740a2c0cfc6b308126d31d7f265fa2be74f3bb095cd2f143ea970896ae5", "size_bytes": 11203},
    {"path": "chn_jpn_yue_eng_ko_spectok.bpe.model", "sha256": "aa87f86064c3730d799ddf7af3c04659151102cba548bce325cf06ba4da4e6a8", "size_bytes": 377341},
    {"path": "config.yaml", "sha256": "f71e239ba36705564b5bf2d2ffd07eece07b8e3f2bbf6d2c99d8df856339ac19", "size_bytes": 1855},
    {"path": "configuration.json", "sha256": "02810a7f8e9e8aee10370a265f7e799728ce25b4c00cdbf4602b303ee395a38e", "size_bytes": 396},
    {"path": "model.pt", "sha256": "833ca2dcfdf8ec91bd4f31cfac36d6124e0c459074d5e909aec9cabe6204a3ea", "size_bytes": 936291369},
    {"path": "tokens.json", "sha256": "a2594fc1474e78973149cba8cd1f603ebed8c39c7decb470631f66e70ce58e97", "size_bytes": 352064}
  ],
  "storage": {"download_bytes": 937034228, "recommended_free_bytes": 2000000000},
  "license": "apache-2.0",
  "runtime": {"consumer": "funasr", "network_at_runtime": false},
  "asr": {"languages": ["zh", "yue", "en", "ja", "ko"], "supports_itn": true}
}
