{
  "schema_version": 1,
  "id": "bge-m3",
  "display_name": "BGE-M3",
  "capability": "embedding",
  "source": {
    "provider": "modelscope",
    "repository": "BAAI/bge-m3",
    "revision": "e44369c5623cc146f016da906583db4ee0e3488d",
    "revision_policy": "pinned"
  },
  "files": [
    {"path": "1_Pooling/config.json", "sha256": "e54c164a07274f2eb45bb724f54a79d1efcc90c41573887cd9a29aeee0597352", "size_bytes": 191},
    {"path": "colbert_linear.pt", "sha256": "19bfbae397c2b7524158c919d0e9b19393c5639d098f0a66932c91ed8f5f9abb", "size_bytes": 2100674},
    {"path": "config.json", "sha256": "26159e7ad065073448460117eb24b7a4572f6f4e78eadff65dc0a11c052449fa", "size_bytes": 687},
    {"path": "config_sentence_transformers.json", "sha256": "1eef72430e7194a1e59680e635aed81ffa083f05668dbc5bb1c56c04c0999c38", "size_bytes": 123},
    {"path": "configuration.json", "sha256": "007c616ed9187f4f3d6096ed2d55cece33c3f48866dbd7bc6afefcb9645a37c1", "size_bytes": 77},
    {"path": "modules.json", "sha256": "84e40c8e006c9b1d6c122e02cba9b02458120b5fb0c87b746c41e0207cf642cf", "size_bytes": 349},
    {"path": "pytorch_model.bin", "sha256": "b5e0ce3470abf5ef3831aa1bd5553b486803e83251590ab7ff35a117cf6aad38", "size_bytes": 2271145830},
    {"path": "sentence_bert_config.json", "sha256": "eb9b44b13c0f52a3b3685c3b1cbdea1ba8b04bea123b98f61610048940776eb1", "size_bytes": 54},
    {"path": "sentencepiece.bpe.model", "sha256": "cfc8146abe2a0488e9e2a0c56de7952f7c11ab059eca145a0a727afce0db2865", "size_bytes": 5069051},
    {"path": "sparse_linear.pt", "sha256": "45c93804d2142b8f6d7ec6914ae23a1eee9c6a1d27d83d908a20d2afb3595ad9", "size_bytes": 3516},
    {"path": "special_tokens_map.json", "sha256": "8c785abebea9ae3257b61681b4e6fd8365ceafde980c21970d001e834cf10835", "size_bytes": 964},
    {"path": "tokenizer.json", "sha256": "21106b6d7dab2952c1d496fb21d5dc9db75c28ed361a05f5020bbba27810dd08", "size_bytes": 17098108},
    {"path": "tokenizer_config.json", "sha256": "a62b2b6784f990259fddef5f16388693a8043be4f69179e6a5257eeb3f9abac4", "size_bytes": 444}
  ],
  "storage": {"download_bytes": 2295420068, "recommended_free_bytes": 4000000000},
  "license": "mit",
  "runtime": {"consumer": "tei", "network_at_runtime": false},
  "embedding": {"dimensions": 1024, "normalize": true, "query_prefix": "", "passage_prefix": ""}
}
